{
  "$schema": "http://json-schema.org/draft-06/schema#",
  "title": "Wave Config Schema",
  "description": "A simple schema to describe Wave messages",
  "type": "array",
  "items": {
    "type": "object",
    "properties": {
      "name": {
        "description": "message type - abbreviated name",
        "type": "string"
      },
      "psid": {
        "description": "psid assigned to message type in 2-byte Hex ie 8003 or 0020",
        "type": "string"
      },
      "dsrc_id": {
        "description": "J2735 wave id assigned to message type in decimal",
        "type": "string"
      },
      "channel": {
        "description": "Wave radio channel assigned to message type in decimal",
        "type": "string"
      },
      "priority": {
        "description": "WSM Priority to use assigned to message type in decimal",
        "type": "string"
      }
    },
    "required":["name","psid","dsrc_id","channel","priority"]
  }
}